{
  "$schema": "https://json-schema.org/draft/2020-12/schema",
  "$id": "firstmate/governed-dispatch-policy/v1",
  "title": "Governed dispatch policy artifact",
  "description": "Closed, total schema for docs/model-economy/governed-dispatch-policy.json — the single machine-authoritative source for the governed-dispatch semantic data (pinned request schema id, model tier order, committed task-class taxonomy, Opus-insufficiency denylist). additionalProperties:false at every level; every array uniqueItems and non-empty. The validator proves the policy artifact against this schema before trusting any datum in it, exactly as it proves the request against the request schema — no untyped policy value, no unadmitted key.",
  "type": "object",
  "additionalProperties": false,
  "required": [
    "schema_version",
    "source_authority",
    "description",
    "supported_request_schema_version",
    "policy_version",
    "model_tier_order",
    "task_classes",
    "insufficient_reason_phrases"
  ],
  "properties": {
    "schema_version": {"type": "string", "const": "firstmate/governed-dispatch-policy/v1"},
    "source_authority": {"type": "string", "minLength": 1},
    "description": {"type": "string", "minLength": 1},
    "supported_request_schema_version": {"type": "string", "const": "firstmate/governed-dispatch-request/v1"},
    "policy_version": {"type": "string", "const": "routing-policy v1"},
    "model_tier_order": {
      "type": "array",
      "minItems": 2,
      "uniqueItems": true,
      "items": {"type": "string", "enum": ["haiku", "sonnet", "opus", "fable"]}
    },
    "task_classes": {
      "type": "array",
      "minItems": 1,
      "uniqueItems": true,
      "items": {"type": "string", "minLength": 1}
    },
    "insufficient_reason_phrases": {
      "type": "array",
      "minItems": 1,
      "uniqueItems": true,
      "items": {"type": "string", "minLength": 1}
    }
  }
}
